{
  "candidate": null,
  "current": "(x**3 - x)/(x**2 - 1)",
  "difficulty": 2,
  "expected_verdict": null,
  "family": "rational",
  "functions": [],
  "hidden_from_proposer": true,
  "human_reference": "x",
  "id": "B-cancel",
  "ladder_id": null,
  "mutation_type": null,
  "notes": "",
  "provenance": "curated equivalent pair; gold hidden from proposer",
  "source_file": null,
  "source_format": "sympy",
  "split": "dev",
  "structural_descriptors": {
    "count_ops": 5,
    "free_symbols": [
      "x"
    ],
    "indexed_calls": 0,
    "indexed_names": [],
    "piecewise": 0,
    "piecewise_branches": 0,
    "products": 0,
    "sums": 0
  },
  "symbols": [
    {
      "name": "x",
      "nonzero": false,
      "real": true
    }
  ],
  "target_compact": "x",
  "task": "compactify",
  "tier": "B",
  "version": "ssc-bench-v0.1"
}
