{
  "candidate": null,
  "current": "h1(a, b)*h2(b, c) + h1(a, b)*h2(b, c)",
  "difficulty": 2,
  "expected_verdict": null,
  "family": "tensor_identities",
  "functions": [
    "h1",
    "h2"
  ],
  "hidden_from_proposer": true,
  "human_reference": "2*h1(a, b)*h2(b, c)",
  "id": "C-tensor-index",
  "ladder_id": "generic_sum_fold",
  "mutation_type": null,
  "notes": "",
  "provenance": "author-constructed indexed vertex product",
  "source_file": null,
  "source_format": "sympy",
  "split": "dev",
  "structural_descriptors": {
    "count_ops": 4,
    "free_symbols": [
      "a",
      "b",
      "c"
    ],
    "indexed_calls": 2,
    "indexed_names": [
      "h1",
      "h2"
    ],
    "piecewise": 0,
    "piecewise_branches": 0,
    "products": 0,
    "sums": 0
  },
  "symbols": [
    {
      "name": "a",
      "nonzero": false,
      "real": true
    },
    {
      "name": "b",
      "nonzero": false,
      "real": true
    },
    {
      "name": "c",
      "nonzero": false,
      "real": true
    }
  ],
  "target_compact": "2*h1(a, b)*h2(b, c)",
  "task": "compactify",
  "tier": "C",
  "version": "ssc-bench-v0.1"
}
