{
  "candidate": "x + 1",
  "current": "(x**2 - 1)/(x - 1)",
  "difficulty": 2,
  "expected_verdict": "ZERO",
  "family": "rational",
  "functions": [],
  "hidden_from_proposer": true,
  "human_reference": null,
  "id": "A-rat-diffsq",
  "ladder_id": null,
  "mutation_type": null,
  "notes": "",
  "provenance": "generated exact identity; engine-confirmed ZERO",
  "source_file": null,
  "source_format": "sympy",
  "split": "dev",
  "structural_descriptors": {
    "count_ops": 4,
    "free_symbols": [
      "x"
    ],
    "indexed_calls": 0,
    "indexed_names": [],
    "piecewise": 0,
    "piecewise_branches": 0,
    "products": 0,
    "sums": 0
  },
  "symbols": [
    {
      "name": "x",
      "nonzero": false,
      "real": true
    }
  ],
  "target_compact": null,
  "task": "adjudicate",
  "tier": "A",
  "version": "ssc-bench-v0.1"
}
