{
  "candidate": "a*Sum(f(n), (n, 1, N - 1))",
  "current": "Sum(a*f(n), (n, 1, N))",
  "difficulty": 2,
  "expected_verdict": "NONZERO",
  "family": "nested_sum",
  "functions": [
    "f"
  ],
  "hidden_from_proposer": true,
  "human_reference": null,
  "id": "A-sum-linear-bound",
  "ladder_id": null,
  "mutation_type": "changed_summation_bound",
  "notes": "actual_verdict=NONZERO",
  "provenance": "controlled corruption of an engine-confirmed identity",
  "source_file": null,
  "source_format": "sympy",
  "split": "dev",
  "structural_descriptors": {
    "count_ops": 3,
    "free_symbols": [
      "N",
      "a"
    ],
    "indexed_calls": 1,
    "indexed_names": [
      "f"
    ],
    "piecewise": 0,
    "piecewise_branches": 0,
    "products": 0,
    "sums": 1
  },
  "symbols": [
    {
      "name": "a",
      "nonzero": false,
      "real": true
    },
    {
      "name": "N",
      "nonzero": false,
      "real": true
    },
    {
      "name": "n",
      "nonzero": false,
      "real": true
    }
  ],
  "target_compact": null,
  "task": "adjudicate",
  "tier": "A",
  "version": "ssc-bench-v0.1"
}
