{
  "candidate": "0",
  "current": "polygamma(0, z) - polygamma(0, z)",
  "difficulty": 1,
  "expected_verdict": "ZERO",
  "family": "special_function",
  "functions": [],
  "hidden_from_proposer": true,
  "human_reference": null,
  "id": "A-sf-poly-zero",
  "ladder_id": null,
  "mutation_type": null,
  "notes": "",
  "provenance": "generated exact identity; engine-confirmed ZERO",
  "source_file": null,
  "source_format": "sympy",
  "split": "dev",
  "structural_descriptors": {
    "count_ops": 0,
    "free_symbols": [],
    "indexed_calls": 0,
    "indexed_names": [],
    "piecewise": 0,
    "piecewise_branches": 0,
    "products": 0,
    "sums": 0
  },
  "symbols": [
    {
      "name": "z",
      "nonzero": false,
      "real": true
    }
  ],
  "target_compact": null,
  "task": "adjudicate",
  "tier": "A",
  "version": "ssc-bench-v0.1"
}
